{
  "heroTitle": "Transforming Lives",
  "heroSubtitle": "Through Biblical Truth",
  "heroVerse": "Strong Marriages. Christian Leadership. Spiritual Awakening. Youth Empowerment. A ministry dedicated to restoring families and equipping communities.",
  "heroRef": "www.petermilimo.org",
  "ministryIntro": "Welcome to the official ministry and leadership platform of Peter Milimo — a place dedicated to restoring families, strengthening faith, equipping communities, and raising a generation grounded in biblical truth and practical skills.",
  "ministryBody": "Through biblical teaching, marriage mentorship, Christian leadership, books, and technical empowerment programs, this ministry exists to bring healing, spiritual awakening, and transformation to individuals, families, churches, and communities.",
  "statYears": "10+",
  "statFamilies": "1K+",
  "statPillars": "4",
  "email": "biblebcc@gmail.com",
  "facebookUrl": "https://web.facebook.com/people/Life-Principles-with-Peter-Milimo/61590553761890/?rdid=fmL8IUONYOVooBWD&share_url=https%3A%2F%2Fweb.facebook.com%2Fshare%2F1HAGGD3H6e%2F%3F_rdc%3D1%26_rdr",
  "youtubeMainUrl": "https://youtube.com/@biblebelieverschristchurch?si=ovKptXMH-4ZL1Ryt",
  "paybillNumber": "400200",
  "accountNumber": "1169454",
  "accountName": "Peter M. Kisiangani",
  "bookPrice": "KSh 1,200",
  "paypalEmail": "biblebcc@gmail.com"
}
